School_Year,Grade_K,Grade_1,Grade_2,Grade_3,Grade_4,Grade_5,Grade_6,Grade_7,Grade_8,Total_Enrollment,Waitlist_Total,New_Applications,Attrition_Count,Attrition_Rate,Free_Reduced_Lunch_Pct,ELL_Pct,SpEd_Pct,Students_of_Color_Pct,Notes
2019-2020,40,38,35,32,30,28,25,22,18,268,12,95,8,3.0%,62.0%,18.0%,11.0%,71.0%,First year of operation. Opened K-8 with smaller upper grades. Strong initial demand.
2020-2021,42,40,38,36,33,30,28,26,22,295,18,110,10,3.4%,64.0%,19.0%,11.5%,72.0%,COVID year. Enrollment held steady despite pandemic. Virtual option offered Sept-Jan.
2021-2022,44,42,41,39,37,34,31,29,26,323,25,125,12,3.7%,63.0%,20.0%,12.0%,73.0%,Post-COVID recovery. Strong re-enrollment. Added sections in K and 1st grade.
2022-2023,44,44,43,42,40,38,35,32,29,347,32,140,14,4.0%,65.0%,21.0%,12.5%,74.0%,Continued growth. Approaching building capacity. Waitlist growing especially K-2.
2023-2024,45,45,44,44,43,41,39,36,32,369,45,155,15,4.1%,66.0%,22.0%,13.0%,75.0%,Near capacity. Board discussed expansion options. Charter renewal approved for 5 years.
2024-2025,44,45,47,49,51,53,56,55,51,420,58,168,16,3.8%,67.0%,23.0%,13.8%,76.0%,At maximum enrollment for current facility. Largest waitlist ever. Attrition stable.
2025-2026 (Projected),44,44,46,48,50,52,54,56,55,420,65,170,16,3.8%,68.0%,24.0%,14.0%,76.0%,Projected to maintain full enrollment. Waitlist expected to grow. Facility constraints limit growth.
2026-2027 (Projected),44,44,45,47,49,51,53,55,56,420,70,175,15,3.6%,68.0%,24.0%,14.5%,77.0%,Stable enrollment projected. Board exploring lease options for additional space.
Capacity,50,50,50,50,55,55,60,60,55,485,,,,,,,,,"Building capacity per grade based on classroom sizes and staffing model. Total building capacity ~485."